{
  "format_version": 1,
  "name": "France — commerces courants",
  "description": "Enseignes, opérateurs et services récurrents les plus fréquents sur un relevé bancaire français. Chaque règle vise une catégorie système, donc ce pack s'importe sur n'importe quelle installation.",
  "locale": "fr",
  "rules": [
    { "field": "merchant", "type": "contains", "pattern": "CARREFOUR", "category_key": "category.food.groceries" },
    { "field": "merchant", "type": "contains", "pattern": "LECLERC", "category_key": "category.food.groceries" },
    { "field": "merchant", "type": "contains", "pattern": "INTERMARCHE", "category_key": "category.food.groceries" },
    { "field": "merchant", "type": "contains", "pattern": "SUPER U", "category_key": "category.food.groceries" },
    { "field": "merchant", "type": "contains", "pattern": "AUCHAN", "category_key": "category.food.groceries" },
    { "field": "merchant", "type": "contains", "pattern": "LIDL", "category_key": "category.food.groceries" },
    { "field": "merchant", "type": "contains", "pattern": "ALDI", "category_key": "category.food.groceries" },
    { "field": "merchant", "type": "contains", "pattern": "CASINO", "category_key": "category.food.groceries", "comment": "Groupe Casino / Petit Casino — l'enseigne alimentaire, pas un jeu d'argent." },
    { "field": "merchant", "type": "contains", "pattern": "MONOPRIX", "category_key": "category.food.groceries" },
    { "field": "merchant", "type": "contains", "pattern": "FRANPRIX", "category_key": "category.food.groceries" },
    { "field": "merchant", "type": "contains", "pattern": "PICARD", "category_key": "category.food.groceries" },
    { "field": "merchant", "type": "contains", "pattern": "GRAND FRAIS", "category_key": "category.food.groceries" },
    { "field": "merchant", "type": "contains", "pattern": "NATURALIA", "category_key": "category.food.groceries" },
    { "field": "merchant", "type": "contains", "pattern": "BIOCOOP", "category_key": "category.food.groceries" },

    { "field": "merchant", "type": "contains", "pattern": "BOULANGERIE", "category_key": "category.food.restaurants" },
    { "field": "merchant", "type": "contains", "pattern": "MCDONALD", "category_key": "category.food.restaurants" },
    { "field": "merchant", "type": "contains", "pattern": "BURGER KING", "category_key": "category.food.restaurants" },
    { "field": "merchant", "type": "contains", "pattern": "SUBWAY", "category_key": "category.food.restaurants" },
    { "field": "merchant", "type": "contains", "pattern": "KFC", "category_key": "category.food.restaurants" },
    { "field": "merchant", "type": "contains", "pattern": "DOMINO", "category_key": "category.food.restaurants" },
    { "field": "merchant", "type": "contains", "pattern": "UBER EATS", "category_key": "category.food.restaurants", "comment": "Avant UBER : « UBER EATS » doit gagner sur la course VTC." },
    { "field": "merchant", "type": "contains", "pattern": "DELIVEROO", "category_key": "category.food.restaurants" },
    { "field": "merchant", "type": "contains", "pattern": "JUST EAT", "category_key": "category.food.restaurants" },
    { "field": "merchant", "type": "contains", "pattern": "BRASSERIE", "category_key": "category.food.restaurants" },
    { "field": "merchant", "type": "contains", "pattern": "RESTAURANT", "category_key": "category.food.restaurants" },
    { "field": "merchant", "type": "contains", "pattern": "STARBUCKS", "category_key": "category.food.coffee" },
    { "field": "merchant", "type": "contains", "pattern": "COLUMBUS CAFE", "category_key": "category.food.coffee" },

    { "field": "merchant", "type": "contains", "pattern": "TOTALENERGIES", "category_key": "category.transport.fuel" },
    { "field": "merchant", "type": "contains", "pattern": "TOTAL ACCESS", "category_key": "category.transport.fuel" },
    { "field": "merchant", "type": "contains", "pattern": "ESSO", "category_key": "category.transport.fuel" },
    { "field": "merchant", "type": "contains", "pattern": "BP ", "category_key": "category.transport.fuel", "comment": "Espace final : évite d'attraper les libellés commençant par « BPCE »." },
    { "field": "merchant", "type": "contains", "pattern": "STATION SERVICE", "category_key": "category.transport.fuel" },
    { "field": "merchant", "type": "contains", "pattern": "SNCF", "category_key": "category.transport.public_transit" },
    { "field": "merchant", "type": "contains", "pattern": "TRAINLINE", "category_key": "category.transport.public_transit" },
    { "field": "merchant", "type": "contains", "pattern": "RATP", "category_key": "category.transport.public_transit" },
    { "field": "merchant", "type": "contains", "pattern": "ILE DE FRANCE MOBILITES", "category_key": "category.transport.public_transit" },
    { "field": "merchant", "type": "contains", "pattern": "NAVIGO", "category_key": "category.transport.public_transit" },
    { "field": "merchant", "type": "contains", "pattern": "BLABLACAR", "category_key": "category.transport.public_transit" },
    { "field": "merchant", "type": "contains", "pattern": "FLIXBUS", "category_key": "category.transport.public_transit" },
    { "field": "merchant", "type": "contains", "pattern": "UBER", "category_key": "category.transport.public_transit", "comment": "Après UBER EATS ; premier match gagnant, l'ordre du pack est significatif." },
    { "field": "merchant", "type": "contains", "pattern": "BOLT", "category_key": "category.transport.public_transit" },
    { "field": "merchant", "type": "contains", "pattern": "VINCI AUTOROUTES", "category_key": "category.transport.parking" },
    { "field": "merchant", "type": "contains", "pattern": "INDIGO PARK", "category_key": "category.transport.parking" },
    { "field": "merchant", "type": "contains", "pattern": "EFFIA", "category_key": "category.transport.parking" },
    { "field": "merchant", "type": "contains", "pattern": "PARKING", "category_key": "category.transport.parking" },
    { "field": "merchant", "type": "contains", "pattern": "NORAUTO", "category_key": "category.transport.car_maintenance" },
    { "field": "merchant", "type": "contains", "pattern": "FEU VERT", "category_key": "category.transport.car_maintenance" },
    { "field": "merchant", "type": "contains", "pattern": "MIDAS", "category_key": "category.transport.car_maintenance" },
    { "field": "merchant", "type": "contains", "pattern": "CONTROLE TECHNIQUE", "category_key": "category.transport.car_maintenance" },

    { "field": "merchant", "type": "contains", "pattern": "PHARMACIE", "category_key": "category.health.pharmacy" },
    { "field": "merchant", "type": "contains", "pattern": "PARAPHARMACIE", "category_key": "category.health.pharmacy" },
    { "field": "description_clean", "type": "contains", "pattern": "CPAM", "category_key": "category.health.doctor" },
    { "field": "merchant", "type": "contains", "pattern": "DOCTOLIB", "category_key": "category.health.doctor" },
    { "field": "merchant", "type": "contains", "pattern": "LABORATOIRE", "category_key": "category.health.doctor" },
    { "field": "merchant", "type": "contains", "pattern": "MUTUELLE", "category_key": "category.health.insurance" },
    { "field": "merchant", "type": "contains", "pattern": "HARMONIE MUTUELLE", "category_key": "category.health.insurance" },
    { "field": "merchant", "type": "contains", "pattern": "MGEN", "category_key": "category.health.insurance" },

    { "field": "merchant", "type": "contains", "pattern": "EDF", "category_key": "category.housing.utilities" },
    { "field": "merchant", "type": "contains", "pattern": "ENGIE", "category_key": "category.housing.utilities" },
    { "field": "merchant", "type": "contains", "pattern": "TOTALENERGIES ELECTRICITE", "category_key": "category.housing.utilities" },
    { "field": "merchant", "type": "contains", "pattern": "VEOLIA", "category_key": "category.housing.utilities" },
    { "field": "merchant", "type": "contains", "pattern": "SUEZ", "category_key": "category.housing.utilities" },
    { "field": "description_clean", "type": "contains", "pattern": "EAU ASSAINISSEMENT", "category_key": "category.housing.utilities" },
    { "field": "description_clean", "type": "contains", "pattern": "LOYER", "category_key": "category.housing.rent" },
    { "field": "description_clean", "type": "contains", "pattern": "QUITTANCE", "category_key": "category.housing.rent" },
    { "field": "description_clean", "type": "contains", "pattern": "PRET IMMOBILIER", "category_key": "category.housing.mortgage" },
    { "field": "description_clean", "type": "contains", "pattern": "ECHEANCE PRET", "category_key": "category.housing.mortgage" },
    { "field": "merchant", "type": "contains", "pattern": "MAIF", "category_key": "category.housing.home_insurance" },
    { "field": "merchant", "type": "contains", "pattern": "MACIF", "category_key": "category.housing.home_insurance" },
    { "field": "merchant", "type": "contains", "pattern": "MATMUT", "category_key": "category.housing.home_insurance" },
    { "field": "description_clean", "type": "contains", "pattern": "ASSURANCE HABITATION", "category_key": "category.housing.home_insurance" },

    { "field": "merchant", "type": "contains", "pattern": "NETFLIX", "category_key": "category.subscriptions" },
    { "field": "merchant", "type": "contains", "pattern": "SPOTIFY", "category_key": "category.subscriptions" },
    { "field": "merchant", "type": "contains", "pattern": "DEEZER", "category_key": "category.subscriptions" },
    { "field": "merchant", "type": "contains", "pattern": "DISNEY", "category_key": "category.subscriptions" },
    { "field": "merchant", "type": "contains", "pattern": "CANAL+", "category_key": "category.subscriptions" },
    { "field": "merchant", "type": "contains", "pattern": "PRIME VIDEO", "category_key": "category.subscriptions" },
    { "field": "merchant", "type": "contains", "pattern": "YOUTUBE PREMIUM", "category_key": "category.subscriptions" },